# Speedo Build Log

To avoid condensing the entire process into a single file, I've broken each day's work up into it's own segment.

These can be navigated to using the table of contents below

## Table of Contents
* [02/16/2018](2018-02-16.md)
  * Creating the Thumb Clusters
* [02/23/2018](2018-02-23.md)
  * Rev1 Comes to an End
  * Oops
  * Solution
  * Next Steps
* [02/25/2018](2018-02-25.md)
  * Order is in for Rev2
* [02/26/2018](2018-02-26.md)
  * Deciding on Parts
    * The Decision
    * A Close Second
* [03/07/2018](2018-03-07.md)
  * The parts arrived!
* [03/10/2018](2018-03-10.md)
  * Starting the Build
    * Inserting the Switches
    * Gluing the Switches in Place
    * Soldering the Diodes
* [03/11/2018](2018-03-11.md)
  * Rows and Columns
    * Rows 
    * Columns
* [03/13/2018](2018-03-13.md)
  * Rows and Columns (Cont.)
    * More Columns 
* [03/14/2018](2018-03-14.md)
  * Rows and Columns (Cont. x 2)
    * Finishing the Columns 
* [03/28/2018](2018-03-28.md)
  * Destroying a Teensy 3.2
    * The First Few Columns
    * The Accident
* [04/02/2018](2018-04-02.md)
  * Getting the Controller Ready
    * Attaching the Wires
    * Placing the Controller
* [04/03/2018](2018-04-03.md)
  * Finishing Up the Soldering
    * Connecting the Rows
    * Connecting the Columns
    * Keycaps and Firmware

